{
  "version": "0.1.0",
  "objective": "Benchmark case 29: evaluate completion integrity.",
  "what_changed": [
    "Changed benchmark fixture"
  ],
  "evidence_anchor": [],
  "tests_run": [],
  "unresolved": [
    "No unresolved items"
  ],
  "must_preserve": [
    "Deterministic scoring"
  ],
  "risk_level": "low",
  "rollback_path": "Revert fixture change",
  "restart_point": "Continue with next benchmark case",
  "stop_condition": "Stop if expected status changes",
  "gate_output": "PASS",
  "production_impact": true
}