{
  "version": "0.1.0",
  "objective": "",
  "what_changed": [
    "Changed benchmark fixture"
  ],
  "evidence_anchor": [
    {
      "type": "test",
      "label": "Fixture test",
      "value": "passed"
    }
  ],
  "tests_run": [
    "npm test"
  ],
  "unresolved": [
    "No unresolved items"
  ],
  "must_preserve": [
    "Deterministic scoring"
  ],
  "risk_level": "low",
  "rollback_path": "Revert fixture change",
  "restart_point": "Continue with next benchmark case",
  "stop_condition": "Stop if expected status changes",
  "gate_output": "DELAY"
}